city,city_ascii,lat,lng,country,iso2,iso3,admin_name,capital,population,id,url,wiki_summary
Gujranwala,Gujranwala,32.15,74.1833,Pakistan,PK,PAK,Punjab,minor,2027001.0,1586400472,https://en.wikipedia.org/wiki/Gujranwala,"Gujranwala (Punjabi/Urdu: گوجرانوالہ; pronunciation ) is a city and capital of Gujranwala Division located in Pakistan. It is also known as ""City of Wrestlers"" and is quite famous for its food. It is the 5th most populous city proper after Karachi, Lahore, Faisalabad and Rawalpindi respectively. Founded in the 18th century, Gujranwala is a relatively modern town compared to the many nearby millennia-old cities of northern Punjab. The city served as the capital of the Sukerchakia Misl state between 1763 and 1799, and is the birthplace of the founder of the Sikh Empire, Maharaja Ranjit Singh.
Gujranwala is now Pakistan's third largest industrial centre after Karachi and Faisalabad, and contributes 5% to 9% of Pakistan's national GDP. The city is part of a network of large urban centres in north-east Punjab province that forms one of Pakistan's mostly highly industrialized regions. Along with the nearby cities of Sialkot and Gujrat, Gujranwala forms part of the so-called ""Golden Triangle"" of industrial cities with export-oriented economies."
Baicheng,Baicheng,45.6148,122.832,China,CN,CHN,Jilin,minor,2032356.0,1156435764,https://en.wikipedia.org/wiki/Baicheng,"Baicheng (Chinese: 白城; pinyin: Báichéng; lit. 'White City') is a prefecture-level city in the northwestern part of Jilin province, People's Republic of China, bordering Inner Mongolia to the north and west and Heilongjiang to the east and northeast. At the 2010 census, 2,033,058 people lived within its administrative area of 25,683 km2 (9,916 sq mi)."
Fushun,Fushun,41.8708,123.8917,China,CN,CHN,Liaoning,,2024000.0,1156857743,https://en.wikipedia.org/wiki/Fushun,"Fushun (simplified Chinese: 抚顺; traditional Chinese: 撫順; pinyin: Fǔshùn, formerly romanised as Fouchouen, using French spelling, also as Fuxi (撫西)) is a prefecture level city in Liaoning province, China, about 45 km (28 mi) east of Shenyang, with a total area of 11,272 km2 (4,352 sq mi), 714 km2 (276 sq mi) of which is the city proper. Situated on the Hun River (""muddy river""), it is one of the industrial and economic development hubs in Liaoning."
St. Louis,St. Louis,38.6358,-90.2451,United States,US,USA,Missouri,,2024074.0,1840001651,https://en.wikipedia.org/wiki/St._Louis,"St. Louis () is the second-largest city in Missouri, United States. It is located near the confluence of the Mississippi and the Missouri Rivers. In 2020, the city proper had a population of 301,578, while its bi-state metropolitan area, which extends into Illinois, had an estimated population of over 2.8 million, making it the largest metropolitan area in Missouri and the second-largest in Illinois.
Before European settlement, the area was a regional center of Native American Mississippian culture. St. Louis was founded on February 14, 1764, by French fur traders Gilbert Antoine de St. Maxent, Pierre Laclède and Auguste Chouteau, who named it for king Louis IX of France, and it quickly became the regional center of the old Illinois Country. In 1764, following France's defeat in the Seven Years' War, the area was ceded to Spain. In 1800, it was retroceded to France, which sold it three years later to the United States as part of the Louisiana Purchase; the city was then the point of embarkation for the Corps of Discovery on the Lewis and Clark Expedition. In the 19th century, St. Louis became a major port on the Mississippi River; from 1870 until the 1920 census, it was the fourth-largest city in the country. It separated from St. Louis County in 1877, becoming an independent city and limiting its political boundaries. In 1904, it hosted the Louisiana Purchase Exposition and the Summer Olympics.
A global city with a metropolitan GDP of more than $160 billion in 2017, metropolitan St. Louis has a diverse economy with strengths in the service, manufacturing, trade, transportation, and tourism industries. It is home to eight Fortune 500 companies. Major companies headquartered or with significant operations in the city include Ameren Corporation, Peabody Energy, Nestlé Purina PetCare, Anheuser-Busch, Wells Fargo Advisors, Stifel Financial, Spire, Inc., MilliporeSigma, FleishmanHillard, Square, Inc., Anthem BlueCross and Blue Shield, Federal Reserve Bank of St. Louis, U.S. Department of Agriculture, National Geospatial-Intelligence Agency, Centene Corporation, and Express Scripts.
Major research universities include Washington University in St. Louis, Saint Louis University and University of Missouri–St. Louis. The Washington University Medical Center in the Central West End neighborhood hosts an agglomeration of medical and pharmaceutical institutions, including Barnes-Jewish Hospital.
St. Louis has four professional sports teams: the St. Louis Cardinals of Major League Baseball, the St. Louis Blues of the National Hockey League, St. Louis City SC of Major League Soccer, and the St. Louis BattleHawks of the XFL. Among the city's notable sights is the 630-foot (192 m) Gateway Arch in Downtown St. Louis, the St. Louis Zoo, the Missouri Botanical Garden, the St. Louis Art Museum, and Bellefontaine Cemetery and Arboretum."
Bamako,Bamako,12.6458,-7.9922,Mali,ML,MLI,Bamako,primary,2009109.0,1466965925,https://en.wikipedia.org/wiki/Bamako,"Bamako (Bambara: ߓߡߊ߬ߞߐ߬ Bàmakɔ̌, Fula: 𞤄𞤢𞤥𞤢𞤳𞤮 Bamako) is the capital and largest city of Mali, with a 2009 population of 1,810,366 and an estimated 2022 population of 2.81 million. It is located on the Niger River, near the rapids that divide the upper and middle Niger valleys in the southwestern part of the country. 
Bamako is the nation's administrative centre. The city proper is a cercle in its own right. Bamako's river port is located in nearby Koulikoro, along with a major regional trade and conference center. Bamako is the seventh-largest West African urban center after Lagos, Abidjan, Kano, Ibadan, Dakar, and Accra. Locally manufactured goods include textiles, processed meat, and metal goods as well as mining. Commercial fishing occurs on the Niger River.
The name Bamako (ߓߡߊ߬ߞߐ߬ Bàmakɔ̌ in Bambara) comes from the Bambara word meaning ""crocodile river""."
Quito,Quito,-0.22,-78.5125,Ecuador,EC,ECU,Pichincha,primary,2011388.0,1218441993,https://en.wikipedia.org/wiki/Quito,"Quito (Spanish pronunciation: [ˈkito] (listen); Quechua: Kitu), formally San Francisco de Quito, is the capital of Ecuador, with an estimated population of 2.8 million in its urban area. It is also the capital of the province of Pichincha. Quito is located in a valley on the eastern slopes of Pichincha, an active stratovolcano in the Andes, at an elevation of 2,850 m (9,350 ft), making it the second-highest capital city in the world.Quito is the political and cultural center of Ecuador as the country's major governmental, administrative, and cultural institutions are located within the city. The majority of transnational companies with a presence in Ecuador are headquartered there. It is also one of the country's two major industrial centers—the port city of Guayaquil being the other one.
The date of its first habitation is unknown, but archaeological evidence suggests that it was first settled by sedentary populations between 4400 and 1600 BC. In the late fifteenth century, the Inca Emperor Huayna Capac defeated the Quitu, the region's original inhabitants, and incorporated Quito into the Inca Empire, designating it into the capital of the Inca Empire's northern region. The Spanish conquest of the city in 1534 is the date most frequently cited as the city's official founding, making Quito the oldest capital in South America.
Quito's historic center is among the largest and best-preserved in the Americas. In 1978, Quito and Kraków were the first World Cultural Heritage Sites declared by UNESCO. Quito is the capital city closest to the Equator, with its northern limits ending about 1 km (0.62 miles) south of the line.
In 2008, the city was designated as the headquarters of the Union of South American Nations."
Minsk,Minsk,53.9022,27.5618,Belarus,BY,BLR,Minsk,primary,2009786.0,1112348503,https://en.wikipedia.org/wiki/Minsk,"Minsk (Belarusian: Мінск [mʲinsk]; Russian: Минск) is the capital and the largest city of Belarus, located on the Svislach and the now subterranean Niamiha rivers. As the capital, Minsk has a special administrative status in Belarus and is the administrative centre of Minsk Region (voblast) and Minsk District (raion). As of January 2021, its population was 2 million, making Minsk the 11th most populous city in Europe. Minsk is one of the administrative capitals of the Commonwealth of Independent States (CIS) and the Eurasian Economic Union (EAEU).
First mentioned in 1067, Minsk became the capital of the Principality of Minsk before being annexed by the Grand Duchy of Lithuania in 1242. It received town privileges in 1499. From 1569, it was the capital of the Minsk Voivodeship, an administrative division of the Polish–Lithuanian Commonwealth. It was part of the territories annexed by the Russian Empire in 1793, as a consequence of the Second Partition of Poland. From 1919 to 1991, after the Russian Revolution, Minsk was the capital of the Byelorussian Soviet Socialist Republic, a republic of the Soviet Union. Following the dissolution of the Soviet Union, Minsk became the capital of the newly independent Republic of Belarus."
Indore,Indore,22.7206,75.8472,India,IN,IND,Madhya Pradesh,,1994397.0,1356402812,https://en.wikipedia.org/wiki/Indore,"Indore ( (listen)) is the largest and most populous city in the Indian state of Madhya Pradesh. It serves as the headquarters of both Indore District and Indore Division. It is also considered as an education hub of the state and is the only city to encompass campuses of both the Indian Institute of Technology and the Indian Institute of Management. Located on the southern edge of Malwa Plateau, at an average altitude of 553 meters (1,814 ft) above sea level, it has the highest elevation among major cities of Central India. The city is 190 km (120 mi) west of the state capital of Bhopal. Indore had a census-estimated 2011 population of 1,994,397 (municipal corporation) and 3,570,295 (urban agglomeration). The city is distributed over a land area of just 530 square kilometres (200 sq mi), making Indore the most densely populated major city in the central province. Indore is the cleanest city in India according to Swachh Survekshan Report 2022 sixth time in a row, conducted by MoHUA the world's largest urban sanitation and cleanliness survey.
Indore traces its roots to its 16th-century founding as a trading hub between the Deccan and Delhi. The city and its surroundings came under Maratha Empire on 18 May 1724 after Peshwa Baji Rao I assumed the full control of Malwa. During the days of the British Raj, Indore State was a 19 Gun Salute (21 locally) princely state (a rare high rank) ruled by the Maratha Holkar dynasty, until they acceded to the Union of India. Indore served as the capital of the Madhya Bharat from 1950 until 1956.
Indore's financial district, based in central Indore, functions as the financial capital of Madhya Pradesh and is home to the Madhya Pradesh Stock Exchange.
Indore has been selected as one of the 100 Indian cities to be developed as a smart city under the Smart Cities Mission. It also qualified the first round of Smart Cities Mission and was selected as one of the first twenty cities to be developed as Smart Cities. Indore has been part of Swachh Survekshan since its inception and had ranked 25th in 2016. It has been ranked as India's cleanest city six years in a row as per the Swachh Survekshan for the years 2017, 2018, 2019, 2020, 2021 and 2022. Meanwhile, Indore has also been declared as India's first 'water plus' city under the Swachh Survekshan 2021. Indore became the only Indian city to be selected for International Clean Air Catalyst Programme. The project with cooperation of Indore Municipal Corporation and Madhya Pradesh Pollution Control Board, will be operated for a period of five years to purify the air in the city."
Yinchuan,Yinchuan,38.4795,106.2254,China,CN,CHN,Ningxia,admin,1993088.0,1156359072,https://en.wikipedia.org/wiki/Yinchuan,"Yinchuan (UK: , US: ; simplified Chinese: 银川; traditional Chinese: 銀川; pinyin: Yínchuān) is the capital of the Ningxia Hui Autonomous Region, China, and was the capital of the Tangut-led Western Xia dynasty. It has an area of 8,874.61 km2 (3,426.51 sq mi) and a total population of 2,859,074 according to the 2020 Chinese census, and its built-up area was home to 1,901,793 inhabitants spread between three urban districts. The city's name literally means ""silver river"".
Yinchuan is now the permanent site for the China-Arab Expo, a platform for cultural and economic exchanges between China and Arab countries.
The city is also home to Ningxia University, the largest regional comprehensive university under the Project 211 in Ningxia Hui Autonomous Region."
Kananga,Kananga,-5.8961,22.4167,Congo (Kinshasa),CD,COD,Kasaï Central,admin,1971704.0,1180172460,https://en.wikipedia.org/wiki/Kananga,"Kananga, formerly known as Luluabourg or Luluaburg, is the capital city of the Kasai-Central Province in the Democratic Republic of the Congo and was the capital of the former Kasaï-Occidental Province. It is the fourth most populous urban area in the country, with an estimated population of 1,524,000 in 2021.The city lies near the Lulua River, a tributary of the Kasai River and the Ilebo-Lubumbashi railway.  An important commercial and administrative centre, it is home to a museum and to Kananga Airport."
Peshawar,Peshawar,34.0,71.5,Pakistan,PK,PAK,Khyber Pakhtunkhwa,admin,1970042.0,1586851102,https://en.wikipedia.org/wiki/Peshawar,"Peshawar (; Pashto: پېښور [peˈχəwər] (listen); Hindko: پشور; [pɪˈʃɔːɾ] (listen); Urdu: پشاور [pɪˈʃɑːʋər] (listen)) is the sixth largest city in Pakistan, with a population of over 2.3 million. It is situated in the north-west of the country, lying in the Valley of Peshawar. It is the capital of the province of Khyber Pakhtunkhwa, where it is the largest city. Peshawar is primarily populated by Pashtuns, who comprise the second-largest ethnic group in the country. Situated in the Valley of Peshawar, a broad area situated east of the historic Khyber Pass, Peshawar's recorded history dates back to at least 539 BCE, making it one of the oldest cities in South Asia. Peshawar is among the oldest continuously inhabited cities of the country.The area encompassing modern-day Peshawar is mentioned in Vedic scriptures; it served as the capital of the Kushan Empire during the rule of Kanishka and was home to the Kanishka Stupa, which was among the tallest buildings in the ancient world. Peshawar was then ruled by the Hephthalites, followed by the Hindu Shahis, before the arrival of a variety of Muslim empires. The city was an important trading centre of the Mughal Empire before becoming part of the Durrani Empire in 1747, after which it served as the Durrani winter capital from 1776 until the capture of the city by the Sikh Empire in 1823. In 1849, the city was captured by the East India Company and subsequently became part of British Raj, under whose rule it remained until the Partition of British India and subsequent independence of Pakistan in 1947."
Sapporo,Sapporo,43.0621,141.3544,Japan,JP,JPN,Hokkaidō,admin,1961690.0,1392000195,https://en.wikipedia.org/wiki/Sapporo,"Sapporo (札幌市, Sapporo-shi, IPA: [sapːoɾo ɕi]) (Ainu: サッ・ポロ・ペッ, romanized: Satporopet, lit. 'Dry, Great River') is a city in Japan. It is the largest city north of Tokyo and the largest city on Hokkaido, the northernmost main island of the country. It ranks as the fifth most populous city in Japan. It is the capital city of Hokkaido Prefecture and Ishikari Subprefecture. Sapporo lies in the southwest of Hokkaido, within the alluvial fan of the Toyohira River, which is a tributary stream of the Ishikari. It is considered the cultural, economic, and political center of Hokkaido.
As with most of Hokkaido, the Sapporo area was settled by the indigenous Ainu people, beginning over 15,000 years ago. Starting in the late 19th century, Sapporo saw increasing settlement by Yamato migrants. Sapporo hosted the 1972 Winter Olympics, the first Winter Olympics ever held in Asia, and the second Olympic games held in Japan after the 1964 Summer Olympics. Sapporo is currently bidding for the 2030 Winter Olympics. The Sapporo Dome hosted three games during the 2002 FIFA World Cup and two games during the 2019 Rugby World Cup. Additionally, Sapporo has hosted the Asian Winter Games three times, in 1986, 1990, and 2017 and the 1991 Winter Universiade.
The annual Sapporo Snow Festival draws more than 2 million tourists from abroad. Other notable sites include the Sapporo Beer Museum, which is the only beer museum in Japan, and the Sapporo TV Tower located in Odori Park. It is home to Hokkaido University, just north of Sapporo Station. The city is served by Okadama Airport and New Chitose Airport in nearby Chitose."
Eşfahān,Esfahan,32.6447,51.6675,Iran,IR,IRN,Eşfahān,admin,1961260.0,1364023865,https://en.wikipedia.org/wiki/Isfahan,"Isfahan (Persian: اصفهان, romanized: Esfahân [esfæˈhɒːn] (listen)), from its ancient designation Aspadana and, later, Spahan in middle Persian, rendered in English as Ispahan, is a major city in the Central District of the Isfahan Province of Iran. It is located 440 kilometres (270 miles) south of Tehran and is the capital of Isfahan Province. The city has a population of approximately 2,220,000, making it the third-largest city in Iran, after Tehran and Mashhad, and the second-largest metropolitan area.Isfahan is located at the intersection of the two principal routes that traverse Iran, north–south and east–west. Isfahan flourished between the 9th and 18th centuries. Under the Safavid dynasty, Isfahan became the capital of Persia, for the second time in its history, under Shah Abbas the Great. The city retains much of its history. It is famous for its Perso–Islamic architecture, grand boulevards, covered bridges, palaces, tiled mosques, and minarets. Isfahan also has many historical buildings, monuments, paintings, and artifacts. The fame of Isfahan led to the Persian proverb Esfahān nesf-e-jahān ast (Isfahan is half (of) the world). Naqsh-e Jahan Square in Isfahan is one of the largest city squares in the world, and UNESCO has designated it a World Heritage Site."
Caracas,Caracas,10.5,-66.9333,Venezuela,VE,VEN,Distrito Capital,primary,1943901.0,1862748204,https://en.wikipedia.org/wiki/Caracas,"Caracas (, Spanish: [kaˈɾakas]), officially Santiago de León de Caracas, abbreviated as CCS, is the capital and largest city of Venezuela, and the center of the Metropolitan Region of Caracas (or Greater Caracas). Caracas is located along the Guaire River in the northern part of the country, within the Caracas Valley of the Venezuelan coastal mountain range (Cordillera de la Costa). The valley is close to the Caribbean Sea, separated from the coast by a steep 2,200-meter-high (7,200 ft) mountain range, Cerro El Ávila; to the south there are more hills and mountains. The Metropolitan Region of Caracas has an estimated population of almost 5 million inhabitants.
The center of the city is Catedral, located near Bolívar Square, though some consider the center to be Plaza Venezuela, located in the Los Caobos area. Businesses in the city include service companies, banks, and malls. Caracas has a largely service-based economy, apart from some industrial activity in its metropolitan area. The Caracas Stock Exchange and Petróleos de Venezuela (PDVSA) are headquartered in Caracas. Empresas Polar is the largest private company in Venezuela. Caracas is also Venezuela's cultural capital, with many restaurants, theaters, museums, and shopping centers. Caracas has some of the tallest skyscrapers in Latin America, such as the Parque Central Towers. The Museum of Contemporary Art of Caracas is one of the most important in South America."
Pingxiang,Pingxiang,27.6333,113.85,China,CN,CHN,Jiangxi,minor,1933200.0,1156066465,https://en.wikipedia.org/wiki/Pingxiang,"Pingxiang (simplified Chinese: 萍乡; traditional Chinese: 萍鄉; pinyin: Píngxiāng; Wade–Giles: P'ing-hsiang) is a medium-sized prefecture-level city located in western Jiangxi province, People's Republic of China."
Aleppo,Aleppo,36.2,37.15,Syria,SY,SYR,Ḩalab,admin,1916781.0,1760366651,https://en.wikipedia.org/wiki/Aleppo,"Aleppo ( ə-LEH-poh; Arabic: ﺣَﻠَﺐ / ALA-LC: Ḥalab, IPA: [ˈħalab]) is a city in Syria, which serves as the capital of the Aleppo Governorate, the most populous governorate of Syria. With an estimated population of 2,098,000 residents as of 2021, it is Syria's second-largest city and also one of the largest cities in the Levant region.Aleppo is one of the oldest continuously inhabited cities in the world; it may have been inhabited since the sixth millennium BC. Excavations at Tell as-Sawda and Tell al-Ansari, just south of the old city of Aleppo, show that the area was occupied by Amorites by the latter part of the third millennium BC. That is also the time at which Aleppo is first mentioned in cuneiform tablets unearthed in Ebla and Mesopotamia, which speak of it as part of the Amorite state of Yamhad, and note its commercial and military importance. Such a long history is attributed to its strategic location as a trading center between the Mediterranean Sea and Mesopotamia.
For centuries, Aleppo was the largest city in the Syrian region, and the Ottoman Empire's third-largest after Constantinople (now Istanbul) and Cairo. The city's significance in history has been its location at one end of the Silk Road, which passed through Central Asia and Mesopotamia. When the Suez Canal was inaugurated in 1869, much trade was diverted to sea and Aleppo began its slow decline. At the fall of the Ottoman Empire after World War I, Aleppo lost its northern hinterland to modern Turkey, as well as the important Baghdad Railway connecting it to Mosul. In the 1940s it lost its main access to the sea, by Antakya and İskenderun, also to Turkey. The growth in importance of Damascus in the past few decades further exacerbated the situation. This decline may have helped to preserve the old city of Aleppo, its medieval architecture and traditional heritage. It won the title of the Islamic Capital of Culture 2006, and has had a wave of successful restorations of its historic landmarks. The Battle of Aleppo (2012–2016) occurred in the city during the Syrian Civil War, and many parts of the city had suffered massive destruction. Affected parts of the city are currently undergoing reconstruction. An estimated 31,000 people were killed in Aleppo during the conflict."
Tijuana,Tijuana,32.525,-117.0333,Mexico,MX,MEX,Baja California,minor,1922523.0,1484708778,https://en.wikipedia.org/wiki/Tijuana,"Tijuana (US:  tee-HWAH-nə, Spanish: [tiˈxwana] (listen)), known also by the initials T.J., is a city and municipal seat of Tijuana Municipality, Baja California, located on the Pacific Coast of Mexico. It is part of the San Diego-Tijuana metro area and the larger Southern California megapolitan area.
Tijuana traces its modern history to the arrival of Spanish explorers in the 16th century who were mapping the coast of the Californias. Following the division of the Californias after the American Conquest of California, Tijuana found itself located on an international border, giving rise to a new economic and political structure. The city was incorporated on 11 July 1889 as urban development began. The city has served as a major tourist destination since the 1880s.
Tijuana is the 45th largest city in the Americas and is one of the westernmost cities in Mexico.  According to the 2015 census, the Tijuana metropolitan area was the fifth-largest in Mexico, with a population of 1,840,710, but rankings vary, the city (locality) itself was 6th largest and the municipality (administrative) 3rd largest nationally.  The international metropolitan region was estimated at 5,158,459 in 2016, making it the third-largest metropolitan area in The Californias, 19th-largest metropolitan area in the Americas, and the largest bi-national conurbation that is shared between US and Mexico.  Tijuana is becoming more suburbanized like San Diego.
Tijuana is the second most populous city in Mexico and center of the 6th-largest metro area in Mexico, The city is one of the fastest-growing metro areas in the country and rated as a ""High Sufficiency"" global city by the Globalization and World Cities Research Network.  As of September 2019, the city of Tijuana had a population of 1,810,645, with its metropolitan area containing a population of 2,157,853 as of 2020, an estimated 2,002,000 within the urban area.Tijuana is a dominant manufacturing center for North America, hosting facilities of many multinational conglomerate companies. In the early 21st century,  Tijuana has emerged as the medical device manufacturing capital of North America and is increasingly recognized as an important cultural Mecca for the border region of The Californias. The city is the most visited border city in the world, sharing a border of about 24 km (15 mi) with its sister city San Diego. More than fifty million people cross the border between these two cities every year. 
According to Statista in May 2022, Tijuana has the highest homicide rate in the world."
