city,city_ascii,lat,lng,country,iso2,iso3,admin_name,capital,population,id,url,wiki_summary
Shenyang,Shenyang,41.8039,123.4258,China,CN,CHN,Liaoning,admin,7208000.0,1156309382,https://en.wikipedia.org/wiki/Shenyang,"Shenyang (UK: , US: ; simplified Chinese: 沈阳; traditional Chinese: 瀋陽; pinyin: Shěnyáng; Mandarin pronunciation: [ʂə̀n.jǎŋ]), formerly known as Fengtian (Chinese: 奉天) or by its Manchu name Mukden, is a major Chinese sub-provincial city and the provincial capital of Liaoning province. Located in north-central Liaoning, it is the province's most populous city, with a total population of 9,070,093 inhabitants as of the 2020 census. Among the resident population of the city, the male population is 4,521,021, accounting for 49.85%; the female population is 4,549,072, accounting for 50.15%. The sex ratio of the total population (with women as 100, the ratio of men to women) dropped from 102.10 in the sixth national census in 2010 to 99.38. Its built-up (or metro) area encompassing 8 Shenyang urban districts and the 4 Fushun urban districts, was home to 8,192,848 inhabitants in 2020. It is also the largest city in Northeast China by urban population, with 7.49 million people (2020 census).Shenyang is also the central city of one of the major megalopolises in China, the Greater Shenyang Metropolitan Area, which has a total population over 23 million.  The city's administrative region includes the ten metropolitan districts of Shenyang proper, the county-level city of Xinmin, and two counties: Kangping and Faku.
Shenyang has passed through the control of many states and peoples in history. In the 14th century, Shenyang came under the control of the Ming dynasty. The city served as an important Chinese military stronghold during the Ming period. The Manchu people conquered Shenyang from the Ming in the 17th century and briefly used it as the capital of Qing dynasty China. In 1905, the Battle of Mukden took place south of Shenyang during the Russo-Japanese War. Japan's subsequent victory allowed Tokyo to annex the region west of the old city and to increase Japanese influence on Shenyang; in September 1931 the Mukden Incident led the Japanese to further invade and occupy the rest of Northeast China, forming the puppet state of Manchukuo.  After the Japanese surrender in 1945, Shenyang remained a Kuomintang stronghold, but the Communists captured it in 1948 after the Liaoshen Campaign.
Along with its nearby cities, Shenyang is an important industrial center in China, and serves as the transportation and commercial hub of China's northeast—particularly involved in links with Japan, Russia and Korea. A center of heavy industry in China since the 1930s, and the spearhead of the Chinese central government's Northeast Area Revitalization Plan, the city has been diversifying its industry, including expanding into the service sector. Growing industries include software, automotive and electronics.
Shenyang is also a major city for scientific research, appearing among the top 200 science cities in the world as tracked by the Nature Index.
The city is home to several major universities, notably Northeastern University and Liaoning University, members of China's prestigious universities in the Double First Class University Plan."
Xingtai,Xingtai,37.0659,114.4753,China,CN,CHN,Hebei,,7104103.0,1156294952,https://en.wikipedia.org/wiki/Xingtai,"Xingtai (simplified Chinese: 邢台; traditional Chinese: 邢臺; pinyin: Xíngtái; Wade–Giles: Hsing2-tʻai2), formerly known as Xingzhou and Shunde, is a prefecture-level city in southern Hebei province, People's Republic of China. It has a total area of 12,486 km2 (4,821 sq mi) and administers 4 districts, 2 county-level cities and 12 counties. At the 2020 census, its population was 7,111,106 inhabitants. It borders Shijiazhuang and Hengshui in the north, Handan in the south, and the provinces of Shandong and Shanxi in the east and west respectively."
Xi’an,Xi'an,34.2667,108.9,China,CN,CHN,Shaanxi,admin,7090000.0,1156244079,https://en.wikipedia.org/wiki/Xi%27an,"Xi'an (UK:  shee-AN, US:  shee-AHN; Chinese: 西安; pinyin: Xī'ān; Chinese: [ɕí.án] (listen)), frequently spelled as Xian and also known by other names, is the capital of Shaanxi Province. A sub-provincial city on the Guanzhong Plain, the city is the third most populous city in Western China, after Chongqing and Chengdu, as well as the most populous city in Northwest China. Its total population was 12,952,907 as of the 2020 census. The total urban population was 9.28 million.Since the 1980s, as part of the economic growth of inland China especially for the central and northwest regions, Xi'an has re-emerged as a cultural, industrial, political and educational centre of the entire central-northwest region, with many facilities for research and development. Xi'an currently holds sub-provincial status, administering 11 districts and 2 counties. In 2020, Xi'an was ranked as a Beta- (global second tier) city by the Globalization and World Cities Research Network, and, according to the country's own ranking, ranked 17th. Xi'an is also one of the world's top 100 financial centers, according to the Global Financial Centres Index. Xi'an is ranked in the top 30 cities in the world by scientific research output as tracked by the Nature Index, and home to multiple China's prestige universities in Northwest China, including Xi'an Jiaotong University, Northwestern Polytechnical University, Xidian University and Northwest University.Known as Chang'an in much of its history, Xi'an is one of the Chinese Four Great Ancient Capitals, having held the position under several of the most important dynasties in Chinese history, including Western Zhou, Western Han, Sui, Northern Zhou and Tang. During the Republican period, Xi'an is known for the site of the Xi'an Incident when Nationalist leader Chiang Kai-shek was kidnapped by one of his generals forcing the Nationalists and Communists to join forces to battle against the Japanese army in the Second Sino-Japanese War. Today, Xi'an is now the second most popular tourist destination in China. The city is the starting point of the Silk Road and home to the Terracotta Army of Emperor Qin Shi Huang, both of which are listed as UNESCO World Heritage sites."
Santiago,Santiago,-33.45,-70.6667,Chile,CL,CHL,Región Metropolitana,primary,7026000.0,1152554349,https://en.wikipedia.org/wiki/Santiago,"Santiago (, US also ; Spanish: [sanˈtjaɣo]), also known as Santiago de Chile, is the capital and largest city of Chile and one of the largest cities in the Americas. It is located in the country's central valley and is the center of the Santiago Metropolitan Region, which has a population of 7 million, representing 40% of Chile's total population. Most of the city is situated between 500–650 m (1,640–2,133 ft) above sea level.
Founded in 1541 by the Spanish conquistador Pedro de Valdivia, Santiago has served as the capital city of Chile since colonial times. The city has a downtown core of 19th-century neoclassical architecture and winding side-streets featuring a mix of art deco, neo-gothic, and other styles. Santiago's cityscape is defined by several stand-alone hills and the fast-flowing Mapocho River, which is lined by parks such as Parque Forestal and Balmaceda Park. The Andes Mountains can be seen from most parts of the city and contribute to a smog problem, particularly during winter, due to the lack of rain. The outskirts of the city are surrounded by vineyards, and Santiago is within an hour's drive of both the mountains and the Pacific Ocean.
Santiago is the political and financial center of Chile and is home to the regional headquarters of many multinational corporations. The Chilean executive and judiciary branches are based in Santiago, while the Congress mostly meets in nearby Valparaíso."
Yantai,Yantai,37.3997,121.2664,China,CN,CHN,Shandong,,6968202.0,1156932948,https://en.wikipedia.org/wiki/Yantai,"Yantai, formerly known as Chefoo, is a coastal prefecture-level city on the Shandong Peninsula in northeastern Shandong province of People's Republic of China.  Lying on the southern coast of the Bohai Strait, Yantai borders Qingdao on the southwest and Weihai on the east, with sea access to both the Bohai Sea (via the Laizhou Bay and the Bohai Strait) and the Yellow Sea (from both north and south sides of the Shandong Peninsula).  It is the largest fishing seaport in Shandong.  Its population was 6,968,202 during the 2010 census, of whom 2,227,733 lived in the built-up area made up of the 4 urban districts of Zhifu, Muping, Fushan and Laishan."
Riyadh,Riyadh,24.65,46.71,Saudi Arabia,SA,SAU,Ar Riyāḑ,primary,6889000.0,1682999334,https://en.wikipedia.org/wiki/Riyadh,"Riyadh (, Arabic: الرياض, romanized: 'ar-Riyāḍ, lit.: 'The Gardens' [ar.riˈjaːdˤ] Najdi pronunciation: [er.rɪˈjɑːðˤ]), formerly known as Hajr al-Yamamah, is the capital and largest city of Saudi Arabia. It is also the capital of the Riyadh Province and the centre of the Riyadh Governorate.
It is the largest city on the Arabian Peninsula, and is situated in the center of the an-Nafud desert, on the eastern part of the Najd plateau. The city sits at an average of 600 meters (2,000 ft) above sea level, and receives around 5 million tourists each year, making it the forty-ninth most visited city in the world and the 6th in the Middle East. Riyadh had a population of 7.6 million people in 2019, making it the most-populous city in Saudi Arabia, 3rd most populous in the Middle East, and 38th most populous in Asia.The first mentioning of the city by the name Riyadh was in 1590, by an early Arab chronicler. In 1737, Deham Ibn Dawwas, who was from the neighboring Manfuha, settled in and took control of the city. Deham built a wall around the city, and the best-known source of the name Riyadh is from this period, thought to be referring to the earlier oasis towns that predated the wall built by Ibn Dawwas. In 1744, Muhammad ibn 'Abd al-Wahhab formed an alliance with the Emir of Diriyah, Muhammad bin Saud, and they took Riyadh from Deham. However their state, now known as the First Saudi State, came to a collapse in 1818. Turki ibn Abdullah founded the Second Saudi State in the early 19th century and made Riyadh his capital in 1825. However, his reign over the city was disrupted by a joint Ottoman–Rashidi alliance. Finally, in the early 20th century, 'Abdulaziz ibn Saud, known in the west simply as Ibn Saud, retrieved his ancestral kingdom of Najd in 1902 and consolidated his rule by 1926 with the final Saudi conquest of Hejaz, subsequently naming his kingdom 'Saudi Arabia' in September 1932 with Riyadh as the capital.Riyadh is the political and administrative center of Saudi Arabia. The Consultative Assembly (also known as the Shura or Shura Council), the Council of Ministers, the King and the Supreme Judicial Council are all situated in the city. Alongside these four bodies that form the core of the legal system of Saudi Arabia, the headquarters of other major and minor governmental bodies are also located in Riyadh. The city hosts 114 foreign embassies, most of which are located in the Diplomatic Quarter in the western reaches of the city.
Riyadh also holds great economic significance, as it hosts the headquarters of many banks and major companies, such as the Saudi National Bank (SNB), Al-Rajhi Bank, SABIC, Almarai, STC, and Samba Financial Group. Highway 65, known locally as the King Fahd Road, runs through some of these important centers in the city, including the King Abdullah Financial District, one of the world's largest financial districts, the Faisaliyah Center and the Kingdom Center. Riyadh is one of the world's fastest-growing cities in population and is home to many expatriates. Riyadh has been designated a global city.The city is divided into 15 municipal districts, which are overseen by the Municipality of Riyadh (Arabic: أمانة الرياض, romanized: Amanat 'ar-Riyāḍ, lit. 'Protectorate of Riyadh') headed by the mayor; and the Royal Commission for Riyadh which is chaired by the Governor of the Province, Faisal bin Bandar Al Saud. As of July 2020, the mayor is Faisal bin Abdulaziz bin Mohammed bin Ayyaf Al-Muqrin."
Luoyang,Luoyang,34.6587,112.4245,China,CN,CHN,Henan,,6888500.0,1156069315,https://en.wikipedia.org/wiki/Luoyang,"Luoyang  is a city located in the confluence area of the Luo River and the Yellow River in the west of Henan province. Governed as a prefecture-level city, it borders the provincial capital of Zhengzhou to the east, Pingdingshan to the southeast, Nanyang to the south, Sanmenxia to the west, Jiyuan to the north, and Jiaozuo to the northeast. As of December 31, 2018, Luoyang had a population of 6,888,500 inhabitants with 2,751,400 people living in the built-up (or metro) area made of the city's five out of six urban districts (except the Jili District not continuously urbanized) and Yanshi District, now being conurbated.Situated on the central plain of China, Luoyang is among the oldest cities in China and one of the cradles of Chinese civilization. It is the earliest of the Four Great Ancient Capitals of China."
Kunming,Kunming,25.0433,102.7061,China,CN,CHN,Yunnan,admin,6850000.0,1156477539,https://en.wikipedia.org/wiki/Kunming,"Kunming (; Chinese: 昆明; pinyin: Kūnmíng), also known as Yunnan-Fu, is the capital and largest city of Yunnan province, China. It is the political, economic, communications and cultural centre of the province as well as the seat of the provincial government. The headquarters of many of Yunnan's biggest corporations are based in the city. The city was of great significance during World War II as a Chinese military center, American air base, and transport terminus for the Burma Road. In the middle of the Yunnan–Guizhou Plateau, Kunming is at an altitude of 1,900 metres (6,234 feet) above sea level and a latitude just north of the Tropic of Cancer. As of 2020 census, Kunming had a total population of 8,460,088 inhabitants, of whom 5,604,310 lived in its built-up (or metro) area made of all urban districts but Jinning, not conurbated yet. It is at the northern edge of Dian Lake, surrounded by temples and lake-and-limestone hill landscapes.
Kunming consists of an old, previously walled city, a modern commercial district, residential zones and university areas. It is also one of the top 200 cities in the world by scientific research output. The city has an astronomical observatory, and its institutions of higher learning include Yunnan University, Kunming University of Science and Technology, Yunnan University of Finance and Economics, Kunming Medical University, Yunnan Normal University, Yunnan Agricultural University and Southwest Forestry University. On the northeast mountainous outskirt is a bronze temple dating from the Ming dynasty, the largest of its kind in China.
Kunming's economic importance derives from its geographical position, as it shares a border with various Southeast Asian countries, serving them as a transportation hub in Southwest China, linking by rail to Vietnam and by road to Burma, Laos and Thailand. This positioning also makes the city an important commercial center of trade in the region. 
The city also acts as a gateway to Southeast Asia and South Asia, the Kunming Changshui International Airport is one of the top 40th-busiest airports in the world. Kunming also houses some manufacturing, chiefly the processing of copper, as well as various chemicals, machinery, textiles, paper and cement. Kunming has a nearly 2,400-year history, but its modern prosperity dates only to 1910, when the railway from Hanoi was built. The city has continued to develop rapidly under China's modernization efforts. Kunming's streets have widened while office buildings and housing projects develop at a fast pace. Kunming has been designated a special tourism center and as such sports a proliferation of high-rises and luxury hotels."
Shangrao,Shangrao,28.4419,117.9633,China,CN,CHN,Jiangxi,minor,6810700.0,1156405492,https://en.wikipedia.org/wiki/Shangrao,"Shangrao (simplified Chinese: 上饶; traditional Chinese: 上饒; pinyin: Shàngráo) is a medium-sized prefecture-level city located in the northeast of Jiangxi province, People's Republic of China. The city borders the province of Anhui to the north, the province of Zhejiang to the east, and the province of Fujian to the south. Also, the city's western reaches extend into Poyang Lake. Shangrao had a population of 6,491,088 as of 2020 census whom 1,293,399 lived in the built up (or metro) area made of Xinzhou and Guangxin districts, Guangfeng District not being conurbated yet. Shangrao itself is at the very western edge of the Wu-speaking areas, while most of its associated counties speak Gan."
Hangzhou,Hangzhou,30.25,120.1675,China,CN,CHN,Zhejiang,admin,6713000.0,1156275243,https://en.wikipedia.org/wiki/Hangzhou,"Hangzhou ( or , HANG-joe; Chinese: 杭州, Hangzhounese pronunciation: [ɦɑ̃.tse], Standard Mandarin pronunciation: [xǎŋ.ʈʂóʊ] (listen)), also romanized as Hangchow, is the capital and most populous city of Zhejiang, China. It is located in the northwestern part of the province, sitting at the head of Hangzhou Bay, which separates Shanghai and Ningbo. Hangzhou grew to prominence as the southern terminus of the Grand Canal and has been one of China's most renowned and prosperous cities for much of the last millennium. It is a major economic and e-commerce hub within China, and the second biggest city in Yangtze Delta after Shanghai. Hangzhou is classified as a sub-provincial city and forms the core of the Hangzhou metropolitan area, the fourth-largest in China after Guangzhou-Shenzhen Pearl River agglomeration, Shanghai-Suzhou-Wuxi-Changzhou conurbation and Beijing. As of 2019, the Hangzhou metropolitan area was estimated to produce a gross metropolitan product (nominal) of 3.2 trillion yuan ($486.53 billion), making it larger than the economy of Nigeria (the largest in Africa). As of the 2020 Chinese census, it had a total population of 11,936,010 inhabitants. However, its metropolitan area, populated by 13.035 million people over an area of 8,107.9 km2 (3,130.5 sq mi), consists of all urban districts in Hangzhou and 3 urban districts of the city of Shaoxing.Hangzhou has been repeatedly rated as the best commercial city in mainland China by Forbes and the Chinese city with the highest growth potential by the Economist Intelligence Unit, and it boasts the eighth largest GDP among cities in mainland China with a GDP of around 1.8 trillion RMB ($280 billion).  Home to the headquarters of large global tech companies such as the Alibaba Group, Ant Group and NetEase, Hangzhou is known for attracting professionals and entrepreneurs who work in information technology. Since 2014, its rapid population growth has led to a steady increase in local housing prices. According to the 2020 Hurun Global Rich List, Hangzhou ranks 11th in the world and 6th in China (after Beijing, Shanghai, Hong Kong, Shenzhen and Guangzhou) in the number of resident billionaires.
Hangzhou is a major city for scientific research in the Asia-Pacific, ranking 19th globally by scientific outputs. It hosts several notable universities, including Zhejiang, Zhejiang University of Technology, Hangzhou Normal, Hangzhou Dianzi, Zhejiang A&F, Zhejiang Sci-Tech, Zhejiang Chinese Medical, Westlake, China Jiliang and Zhejiang University of Finance and Economics. In September 2015, Hangzhou was awarded the 2022 Asian Games. Its West Lake, a UNESCO World Heritage Site west of the city, is among its best-known attractions. A study conducted by PwC and China Development Research Foundation ranked Hangzhou first among ""Chinese Cities of Opportunity"". According to the Globalization and World Cities Research Network (GaWC), the city is classified as Beta (global second-tier) city, together with Chongqing, Nanjing and Tianjin in China. Hangzhou is also one of the world's top 100 financial centers, according to the Global Financial Centres Index. It will be the third Chinese city to host the Asian Games, after Beijing 1990 and Guangzhou 2010. Hangzhou also hosted the 11th G20 summit in 2016."
Bijie,Bijie,27.3019,105.2863,China,CN,CHN,Guizhou,,6686100.0,1156018927,https://en.wikipedia.org/wiki/Bijie,"Bijie (simplified Chinese: 毕节; traditional Chinese: 畢節; pinyin: Bìjíe) is a prefecture-level city in northwestern Guizhou Province, China, bordering Sichuan to the north and Yunnan to the west.
The Daotianhe Reservoir, located to the north of the town was commissioned in 1965 with a rated annual capacity of 6.5 million cubic meters.
On 10 November 2011, the former Bijie Prefecture (毕节地区) was converted to a prefecture-level city, and the former county-level city of Bijie was rechristened Qixingguan District."
Quanzhou,Quanzhou,24.9139,118.5858,China,CN,CHN,Fujian,minor,6480000.0,1156829655,https://en.wikipedia.org/wiki/Quanzhou,"Quanzhou, alternatively known as Chinchew, is a prefecture-level port city on the north bank of the Jin River, beside the Taiwan Strait in southern Fujian, China. It is Fujian's largest metropolitan region, with an area of 11,245 square kilometers (4,342 sq mi) and a population of 8,782,285 as of the 2020 census. Its built-up area is home to 6,669,711 inhabitants, encompassing the Licheng, Fengze, and Luojiang urban districts; Jinjiang, Nan'an, and Shishi cities; Hui'an County; and the Quanzhou District for Taiwanese Investment. Quanzhou was China's 12th-largest extended metropolitan area in 2010.
Quanzhou was China's major port for foreign traders, who knew it as Zaiton, during the 11th through 14th centuries. It was visited by both Marco Polo and Ibn Battuta; both travelers praised it as one of the most prosperous and glorious cities in the world. It was the naval base from which the Mongol attacks on Japan and Java were primarily launched and a cosmopolitan center with Buddhist and Hindu temples, Islamic mosques, and Christian churches, including a Catholic cathedral and Franciscan friaries. A failed revolt prompted a massacre of the city's foreign communities in 1357. Economic dislocations—including piracy and an imperial overreaction to it during the Ming and Qing—reduced its prosperity, with Japanese trade shifting to Ningbo and Zhapu and other foreign trade restricted to Guangzhou. Quanzhou became an opium-smuggling center in the 19th century but the siltation of its harbor hindered trade by larger ships.
Because of its importance for medieval maritime commerce, unique mix of religious buildings, and extensive archeological remains, the old town of Quanzhou was inscribed on the UNESCO World Heritage List in 2021."
Miami,Miami,25.7839,-80.2102,United States,US,USA,Florida,,6445545.0,1840015149,https://en.wikipedia.org/wiki/Miami,"Miami ( my-AM-ee), officially the City of Miami, is a coastal metropolis and the seat of Miami-Dade County in South Florida. With a population of 442,241 as of the 2020 census, it is the second-most populous city in the state of Florida after Jacksonville. It is the core of the much larger Miami metropolitan area, which, with a population of 6.138 million, is the third-largest metro in the Southeast and ninth-largest in the United States. The city has the third largest skyline in the U.S. with over 300 high-rises, 58 of which exceed 491 ft (150 m).Miami is a major center and leader in finance, commerce, culture, arts, and international trade. Miami's metropolitan area is by far the largest urban economy in Florida, with a gross domestic product of $344.9 billion as of 2017. According to a 2018 UBS study of 77 world cities, Miami is the second richest city in the U.S. and the third richest globally in purchasing power. Miami is a majority-minority city with a Hispanic population of 310,472, or 70.2 percent of the city's population, as of 2020.Downtown Miami has one of the largest concentrations of international banks in the U.S. and is home to several large national and international companies. The Health District is home to several major University of Miami-affiliated hospital and health facilities, including Jackson Memorial Hospital, the nation's largest hospital with 1,547 beds, and the Leonard M. Miller School of Medicine, the University of Miami's academic medical center and teaching hospital, and others engaged in health-related care and research. PortMiami, the city's seaport, is the busiest cruise port in the world in both passenger traffic and cruise lines. Miami is the second largest tourism hub for international visitors, after New York City. Miami has sometimes been called the Gateway to Latin America because of the magnitude of its commercial and cultural ties to the region.In 2019, Miami ranked seventh in the U.S. in business activity, human capital, information exchange, cultural experience, and political engagement."
